Company,Industry,Location,Description,URL
ＧＳＭ株式会社,Trading company industry company,"Headquarters Address: Naha City, Okinawa Prefecture Naha Naha 2-chome No. 4 No. 3","Company carrying trade, retail and mail order",https://baseconnect.in/companies/keyword/2a970ee1-15a7-45e0-b1eb-37e738712447/companies/c191021b-b72f-4d00-a0fc-35b66ad53a76
申和株式会社,Trading company industry company,"Headquarters Address: Naha City, Okinawa Prefecture, Naha City, Naha City, Naha City, Naha City, Naha City, Naha City No. 21 No. 2 2F West Side",Company that conducts international logistics and trade,https://baseconnect.in/companies/keyword/2a970ee1-15a7-45e0-b1eb-37e738712447/companies/8d249104-28a2-42d2-bc09-d0e73484a9d5
龍田貿易株式会社,Trading company industry company,"Headquarters Address: Nanjiang River 1-chome, Shinagawa-ku, Tokyo",Companys that export to the irregular yaki and Arita-yaki dishes,https://baseconnect.in/companies/keyword/2a970ee1-15a7-45e0-b1eb-37e738712447/companies/eed5ac03-c9c6-470e-b054-13cd0001e556
株式会社アローインターナショナル,Trading company industry company,"Headquarters Address: Nara City Nara City Nara City, Nara City, Nara City, Nara City, 15",Companies involved in trade such as export,https://baseconnect.in/companies/keyword/2a970ee1-15a7-45e0-b1eb-37e738712447/companies/5d635331-6407-40fd-86ae-199a32b9913e
谷口トレーディング株式会社,Trading company industry company,Headquarters Address: Nara Prefecture Amarian City Yanagimoto-cho 2207,Companies to trade for daily necessities and miscellaneous goods,https://baseconnect.in/companies/keyword/2a970ee1-15a7-45e0-b1eb-37e738712447/companies/0c56eb21-1df2-402f-94a3-5fef171f1759
有限会社梅安,Trading company industry company,Headquarters Address: Nara Prefecture Yamato Takada City Old James Kagura 254,Company doing trade,https://baseconnect.in/companies/keyword/2a970ee1-15a7-45e0-b1eb-37e738712447/companies/152d7e37-2999-4d83-a182-060926cb7bce
株式会社光のハウス,Trading company industry company,Headquarters Address: Narita Narita City River 245st 1680,Companies to export entrance trade,https://baseconnect.in/companies/keyword/2a970ee1-15a7-45e0-b1eb-37e738712447/companies/b2ef11bc-bdb4-4999-b842-4f5746aa7fa0
ダイイチ株式会社,Trading company industry company,"Headquarters Address: Negishi 4-chome, Negishi, Tokyo, Tokyo",Company that conducts wholesale food trade and commercial food,https://baseconnect.in/companies/keyword/2a970ee1-15a7-45e0-b1eb-37e738712447/companies/fe63575c-bad7-4ad0-af6e-85eaf8107e31
大陸貿易株式会社,Trading company industry company,"Headquarters Address: Nikikawa 2-chome, Chuo-ku, Tokyo",A company that runs Russia and trade business focusing on imports of wood,https://baseconnect.in/companies/keyword/2a970ee1-15a7-45e0-b1eb-37e738712447/companies/0a0255d9-0a7b-4802-8d28-ebec688decb9
株式会社東京企画,Trading company industry company,"Headquarters Address: Ninobu City, Saitama Prefecture, Saitama City, Section No. 6",Companies that are exporting such as toner Cartriich,https://baseconnect.in/companies/keyword/2a970ee1-15a7-45e0-b1eb-37e738712447/companies/ac5c9a06-685d-4769-823e-409fb5911e20
株式会社平成トレーディング,Trading company industry company,"Headquarters Address: Nishi-ku, Nishi-ku, Nagoya City, Aichi Prefecture 131st",Company carrying daily goods miscellaneous goods trading,https://baseconnect.in/companies/keyword/2a970ee1-15a7-45e0-b1eb-37e738712447/companies/2553f11f-e78c-4fb0-8615-7a12b93694d8
トーカ貿易株式会社,Trading company industry company,"Headquarters Address: Nishinomiya City, Hyogo Prefecture No. 8 No. 13",Company doing trade,https://baseconnect.in/companies/keyword/2a970ee1-15a7-45e0-b1eb-37e738712447/companies/08e95f76-71dd-4383-b764-8ac499a38981
株式会社菅沼,Trading company industry company,"Headquarters Address: Ogi-ku, Kitakyushu City, Fukuoka Prefecture",Company that manufactures and imports billiards table,https://baseconnect.in/companies/keyword/2a970ee1-15a7-45e0-b1eb-37e738712447/companies/b35ecc9e-ab94-4aa3-b01f-feb520691f37
大德企業有限会社,Trading company industry company,Headquarters Address: Oi 5-chome 10th No. 4,Company doing trade,https://baseconnect.in/companies/keyword/2a970ee1-15a7-45e0-b1eb-37e738712447/companies/a1133787-5e27-446b-ab7d-ede626d1b2bd
株式会社岡山県通商センター,Trading company industry company,"Headquarters Address: Okayama City Okayama City, Okayama Prefecture 1-chome 37th",A company that works with apparel products and overseas trade business,https://baseconnect.in/companies/keyword/2a970ee1-15a7-45e0-b1eb-37e738712447/companies/19e81208-ef59-4a90-9cae-d90346fcc307
紅葉商事株式会社,Trading company industry company,"Headquarters Address: Okayama Prefecture Okayama Prefecture Kita-ku, Kita-ku, Kita-ku, Kita-ku, Okayama Prefecture",Company doing trade,https://baseconnect.in/companies/keyword/2a970ee1-15a7-45e0-b1eb-37e738712447/companies/5ba0fcb1-9f1b-4d24-a99c-59ec7ddadced
株式会社カフー,Trading company industry company,"Headquarters Address: Okinawa Prefecture Naha Port Town 1-chome 1-18,7","Company that sells trade duties, transport services and construction materials",https://baseconnect.in/companies/keyword/2a970ee1-15a7-45e0-b1eb-37e738712447/companies/7b7a054d-c25f-4795-8a36-34d40b2aca1e
株式会社オダカ,Trading company industry company,"Headquarters Address: Osaka City, Osaka City, Tomoko Tomo-cho, Mitsujima-ku, Mitsujima-shi",Company handling textile trade,https://baseconnect.in/companies/keyword/2a970ee1-15a7-45e0-b1eb-37e738712447/companies/1b4a44d6-3fa2-4d5f-8d26-fe7e52c7b6a5
クラークインターナショナル有限会社,Trading company industry company,Headquarters Address: Osaka Prefecture Chuo Ward Momo Building No. 3,A company that operates a clothing store,https://baseconnect.in/companies/keyword/2a970ee1-15a7-45e0-b1eb-37e738712447/companies/5b8c4af1-d1d7-4de6-89b4-5a1450eb8045
有限会社昌栄スチール,Trading company industry company,Headquarters Address: Osaka Prefecture Chuo Ward Nishidoshinabashi 1-chome No. 12 12th No. 12 Ichi Shishi Bridge Urban Life 901,Company that carries wholesale steel,https://baseconnect.in/companies/keyword/2a970ee1-15a7-45e0-b1eb-37e738712447/companies/59f43389-b948-4ff8-8ce7-168b22f06aae
株式会社円友,Trading company industry company,"Headquarters Address: Osaka Prefecture Chuo-ku, Chuo-ku, Chuo-ku, Chuo-ku, Chuo-ku, Chuo-ku, Chuo-ku, Osaka City.",Company that trade precious metals and gems,https://baseconnect.in/companies/keyword/2a970ee1-15a7-45e0-b1eb-37e738712447/companies/81d51ffb-be40-4ff0-a9ad-3b233e7fe2b8
株式会社光塩トレーディング,Trading company industry company,"Headquarters Address: Osaka Prefecture Chuo-ku, Chuo-ku, Chuo-ku, Chuo-ku, Osaka City No. 4 Cosmic Building No. 502",Company handling trade,https://baseconnect.in/companies/keyword/2a970ee1-15a7-45e0-b1eb-37e738712447/companies/fd93f1a4-bf67-4eac-aa48-b06364b3a5c2
有限会社ベルキャッツコーポレイション,Trading company industry company,"Headquarters Address: Osaka Prefecture Chuo-ku, Osaka City 1-chome No. 6",Company handling textile trade,https://baseconnect.in/companies/keyword/2a970ee1-15a7-45e0-b1eb-37e738712447/companies/00b3e8ad-058f-4dc4-8fc1-97aee2dce4cf
日本マート株式会社,Trading company industry company,"Headquarters Address: Osaka Prefecture Chuo-ku, Osaka City, Chuo Ward No. 7",Companys that import and sell textile materials and textile products from China,https://baseconnect.in/companies/keyword/2a970ee1-15a7-45e0-b1eb-37e738712447/companies/2e47e717-bf48-41a7-ad63-7d1b34353f26
株式会社グランデイール,Trading company industry company,"Headquarters Address: Osaka Prefecture Chuo-ku, Osaka City, Chuo-ku, Chuo-ku, Chuo-ku, Chuo-ku, Osaka City",Company that carries fiber products,https://baseconnect.in/companies/keyword/2a970ee1-15a7-45e0-b1eb-37e738712447/companies/d549f006-9253-48ca-b986-ee4607ef18cd
泰成通商株式会社,Trading company industry company,"Headquarters Address: Osaka Prefecture Chuo-ku, Osaka City, Chuo-ku, Chuo-ku, Chuo-ku, Chuo-ku, Osaka City",Companies that import and export chemical industry or food additives and urethane related products,https://baseconnect.in/companies/keyword/2a970ee1-15a7-45e0-b1eb-37e738712447/companies/1698fffb-51b3-4bab-a771-1c0cda706e7c
和志商事株式会社,Trading company industry company,"Headquarters Address: Osaka Prefecture Chuo-ku, Osaka City, Chuo-ku, Chuo-ku, Chuo-ku, Chuo-ku, Osaka City",Company that exports health food and beauty products,https://baseconnect.in/companies/keyword/2a970ee1-15a7-45e0-b1eb-37e738712447/companies/e8874ba7-6b36-48ba-b518-e3c59a2aacb8
株式会社協同物産貿易,Trading company industry company,"Headquarters Address: Osaka Prefecture Chuo-ku, Osaka City, Chuo-ku, Chuo-ku, Chuo-ku, Nammen-cho",Company that exports steel products such as building materials and steel furniture materials,https://baseconnect.in/companies/keyword/2a970ee1-15a7-45e0-b1eb-37e738712447/companies/8c5812f7-ce19-409c-89c5-385487f9bbe5
野村貿易株式会社,Trading company industry company,"Headquarters Address: Osaka Prefecture Chuo-ku, Osaka City, Chuo-ku, Chuo-ku, Chuo-ku, Osaka","Nomura Trade Group Holding Company, which consigns to import and subsidiaries",https://baseconnect.in/companies/keyword/2a970ee1-15a7-45e0-b1eb-37e738712447/companies/a709aaf8-9712-4ce7-ae9a-cbbe42261489
有限会社ラッチマンエキスポーターズ,Trading company industry company,"Headquarters Address: Osaka Prefecture Chuo-ku, Osaka City, Chuo-ku, Chuo-ku, Chuo-ku, Osaka",Company doing textile trade,https://baseconnect.in/companies/keyword/2a970ee1-15a7-45e0-b1eb-37e738712447/companies/9303d6c4-044e-41ee-9c1d-9f35e331c1d0
有限会社イーストウエストコーポレーション,Trading company industry company,"Headquarters Address: Osaka Prefecture Chuo-ku, Osaka City, Chuo-ku, Chuo-ku, Chuo-ku, Osaka City",Company that conducts Textiles and military export and export,https://baseconnect.in/companies/keyword/2a970ee1-15a7-45e0-b1eb-37e738712447/companies/b7e6dfff-dcd9-47b6-8cbc-7e8e1fd6a54c
株式会社ネオインターナショナル,Trading company industry company,"Headquarters Address: Osaka Prefecture Chuo-ku, Osaka City, Chuo-ku, Chuo-ku, Nammen-cho, Merpacio Honcho Building 802",A company that works for daily goods,https://baseconnect.in/companies/keyword/2a970ee1-15a7-45e0-b1eb-37e738712447/companies/11539fb1-84af-47fe-88e0-88c0edc83597
三易株式会社,Trading company industry company,"Headquarters Address: Osaka Prefecture Chuo-ku, Osaka City, Chuo-ku, J-Chome No. 6 No. 6 Rawada Building 3rd floor",Company that carries trade,https://baseconnect.in/companies/keyword/2a970ee1-15a7-45e0-b1eb-37e738712447/companies/c24977d1-208e-45af-88ab-139f9582ce6f
福富金属工業株式会社,Trading company industry company,"Headquarters Address: Osaka Prefecture Chuo-ku, Osaka City, Chuo-ku, Osaka City, Chuo Ward No. 10-512",Company handling metal trade,https://baseconnect.in/companies/keyword/2a970ee1-15a7-45e0-b1eb-37e738712447/companies/d0db815b-d5a4-4a11-8fd2-425ca1fdbdab
アジア貿易株式会社,Trading company industry company,"Headquarters Address: Osaka Prefecture Chuo-ku, Osaka City, Chuo-ku, Osaka City, Chuo-ku, Osaka City",Company that supports trade administrative services and import and export trade,https://baseconnect.in/companies/keyword/2a970ee1-15a7-45e0-b1eb-37e738712447/companies/24235311-6447-4f97-8ce0-b37f4fb4e5d6
有限会社大阪カーユニオン,Trading company industry company,Headquarters Address: Osaka Prefecture Hagino City Nono 1-chome 11th No. 20,Company to trade,https://baseconnect.in/companies/keyword/2a970ee1-15a7-45e0-b1eb-37e738712447/companies/33678ec8-117d-4389-a680-3012c4c738c0
株式会社ブレットジャパン,Trading company industry company,Headquarters Address: Osaka Prefecture Ikeda City Shincho No. 7 No. 14,Company that operates imported building materials dealers,https://baseconnect.in/companies/keyword/2a970ee1-15a7-45e0-b1eb-37e738712447/companies/feeb6881-c3a6-4a2a-8b8e-68c4cffd8bc9
株式会社チックスコーポレーション,Trading company industry company,Headquarters Address: Osaka Prefecture Minoh City Kiryu Oshiage 4-chome 7th No. 13,Company doing textile trade,https://baseconnect.in/companies/keyword/2a970ee1-15a7-45e0-b1eb-37e738712447/companies/56037098-ad89-4118-af97-b5dca29078d2
株式会社ユーフーインターナショナル,Trading company industry company,Headquarters Address: Osaka Prefecture Minoh City Minoh 8-chome No. 32 No. 32,Company doing fiber trade,https://baseconnect.in/companies/keyword/2a970ee1-15a7-45e0-b1eb-37e738712447/companies/09c6853b-9a9a-419f-8743-dcb9d2eaff53
東和交易株式会社,Trading company industry company,Headquarters Address: Osaka Prefecture Moriguchi City Ryuda 2-chome No. 13-308,Company that trade for electronic parts and electronic devices,https://baseconnect.in/companies/keyword/2a970ee1-15a7-45e0-b1eb-37e738712447/companies/3f19f864-3848-4437-a0b4-552a8b3d49a7
株式会社トモテックス,Trading company industry company,Headquarters Address: Osaka Prefecture Neyagawa City Hachisaka-cho No. 3 No. 3 Nepromy Building 3rd floor,Company doing trade,https://baseconnect.in/companies/keyword/2a970ee1-15a7-45e0-b1eb-37e738712447/companies/2d6af89e-df41-413d-a9b7-44f96ac635b3
匠海トレーディング株式会社,Trading company industry company,Headquarters Address: Osaka Prefecture Nishi Ward Edoori 1-chome No. 9 No. 11,"A company that carries out aquatic product and processing in third countries, and wholesale in Japan",https://baseconnect.in/companies/keyword/2a970ee1-15a7-45e0-b1eb-37e738712447/companies/733ef04c-b77e-47e0-a6ab-3022aff8b3df
大越株式会社,Trading company industry company,"Headquarters Address: Osaka Prefecture Nishi Ward, Nishi-ku, Nishi Ward, Nishi-ku, Osaka City",Trading company handling trade,https://baseconnect.in/companies/keyword/2a970ee1-15a7-45e0-b1eb-37e738712447/companies/36f98207-0bac-4315-a841-bf6dc20e495b
協和株式会社,Trading company industry company,Headquarters Address: Osaka Prefecture Nishi-Ward Kita Hokorie 1-chome No. 4 Nagahori Akira Building,A company handling daily goods goods trade,https://baseconnect.in/companies/keyword/2a970ee1-15a7-45e0-b1eb-37e738712447/companies/e438e3c7-813f-440c-bad6-ef6b30e6fda0
ワールドシッピング株式会社,Trading company industry company,"Headquarters Address: Osaka Prefecture Nishimoto City, Nishimoto-shi 1-chome No.2 No.1","Companies to agency and agency agency of trade, customs clearance and import and export administration",https://baseconnect.in/companies/keyword/2a970ee1-15a7-45e0-b1eb-37e738712447/companies/b7cdc6e1-29f2-47c1-955f-e401b645a11d
アジコン販売株式会社,Trading company industry company,Headquarters Address: Osaka Prefecture Osaka City 1-chome 7th No. 7,Company that sells fuel and auxiliary combustgers such as kerobe additives,https://baseconnect.in/companies/keyword/2a970ee1-15a7-45e0-b1eb-37e738712447/companies/9e91d44a-0e08-4922-ad0c-0ffbe44e9c38
株式会社サンパワー,Trading company industry company,Headquarters Address: Osaka Prefecture Osaka City Chuo Ward Momoji No. 21 21 0 Shanbaall Meno-cho 610,Company that carries outlet and export from Western goods,https://baseconnect.in/companies/keyword/2a970ee1-15a7-45e0-b1eb-37e738712447/companies/73341ee9-42e6-4547-a9c7-ea0c92ebb50d
ケンズピープル株式会社,Trading company industry company,Headquarters Address: Osaka Prefecture Osaka City Chuo-ku 2-chome No.11111,Trading companies that trace for trade and import and export,https://baseconnect.in/companies/keyword/2a970ee1-15a7-45e0-b1eb-37e738712447/companies/8148d76f-e45b-474c-8589-c4537c65a425
森田産業株式会社,Trading company industry company,Headquarters Address: Osaka Prefecture Osaka City Higashi Sumiyoshi Western Nakano 2-chome No. 3 No. 3,Company that exports automotive spare parts,https://baseconnect.in/companies/keyword/2a970ee1-15a7-45e0-b1eb-37e738712447/companies/b05492e9-7d1e-41d5-a5ac-7844548678f0
森振興貿易株式会社,Trading company industry company,Headquarters Address: Osaka Prefecture Osaka City Kita Ward Nishinami 3-chome 12 No. 38 Eight Corporation Daiichi Building 303,Company that conducts trade such as chemical products,https://baseconnect.in/companies/keyword/2a970ee1-15a7-45e0-b1eb-37e738712447/companies/10e2c4b2-5601-48ff-87d2-7ef6fe760535
華明商事株式会社,Trading company industry company,Headquarters Address: Osaka Prefecture Osaka City Kita Ward Toyosaki 3-chome 10th No. 2,Comprehensive trading company that handles industrial carbide abrasives and diamond powder,https://baseconnect.in/companies/keyword/2a970ee1-15a7-45e0-b1eb-37e738712447/companies/c50ed255-ea99-4807-9ae7-0bb194adcf7c
株式会社奏房社,Trading company industry company,Headquarters Address: Osaka Prefecture Osaka City Kita Ward Toyosaki 5-chome No. 23 4F,"Export Japanese technology and products, companies that carry out export / export and development of natural resources and products in Southeast Asia",https://baseconnect.in/companies/keyword/2a970ee1-15a7-45e0-b1eb-37e738712447/companies/e273c0d5-4f33-4c07-a5d3-d0f8eeac184b
華昌産業株式会社,Trading company industry company,Headquarters Address: Osaka Prefecture Osaka City Kita Ward Tsuru-cho 4th A216,Company doing trade,https://baseconnect.in/companies/keyword/2a970ee1-15a7-45e0-b1eb-37e738712447/companies/5d83fc10-1163-4b72-9bd7-08a5de59b7e0
現代綜合金属ジャパン株式会社,Trading company industry company,Headquarters Address: Osaka Prefecture Osaka City Kita-Ward Doshima 1-chome No. 16 16 Aqua Island NBF Tower 13F,Companies that handle welding materials and equipment,https://baseconnect.in/companies/keyword/2a970ee1-15a7-45e0-b1eb-37e738712447/companies/cfe0fbad-6267-4649-a6a0-32961a2728eb
太成産業株式会社,Trading company industry company,Headquarters Address: Osaka Prefecture Osaka City Kita-Ward Tomiyama Town No. 5,Company with equipment trade and wholesale,https://baseconnect.in/companies/keyword/2a970ee1-15a7-45e0-b1eb-37e738712447/companies/cb5af1be-25e1-4d21-a049-a6e154f1ba7f
有限会社エーアイエム,Trading company industry company,Headquarters Address: Osaka Prefecture Osaka City Kita-ku Dong Total 2-chome No. 4,Companies to trade such as furniture and other parts such as tempered glass,https://baseconnect.in/companies/keyword/2a970ee1-15a7-45e0-b1eb-37e738712447/companies/8a92a437-3e34-4417-8fd0-85239659f015
海鷗株式会社,Trading company industry company,Headquarters Address: Osaka Prefecture Osaka City Nakano Island 2-chome 3333,"A company that develops sales routes in China, such as machine products",https://baseconnect.in/companies/keyword/2a970ee1-15a7-45e0-b1eb-37e738712447/companies/26613c22-4965-489f-9ff1-4cecaf25ceee
株式会社グローバル,Trading company industry company,Headquarters Address: Osaka Prefecture Osaka City Nishi Ward Awa Awa 1-chome No.3 No.3,Company doing trade,https://baseconnect.in/companies/keyword/2a970ee1-15a7-45e0-b1eb-37e738712447/companies/bf796a3d-cc59-4f20-8873-e6ea362526d9
大宝産業株式会社,Trading company industry company,Headquarters Address: Osaka Prefecture Osaka City Nishimoto Town 2-chome No. 3,Companies who are trading business such as industrial gases and food products,https://baseconnect.in/companies/keyword/2a970ee1-15a7-45e0-b1eb-37e738712447/companies/df505dca-5b19-4afb-b9cd-2ae856394ae3
加藤貿易株式会社,Trading company industry company,Headquarters Address: Osaka Prefecture Osaka City Nishimoto-cho 1-chome 13th 38-215,A company that carries out or wholesale,https://baseconnect.in/companies/keyword/2a970ee1-15a7-45e0-b1eb-37e738712447/companies/8256b1d8-2fa5-4d49-b814-5b57bf7f77d5
有限会社新興重機,Trading company industry company,Headquarters Address: Osaka Prefecture Osaka City Yodogawa Ward Nishinakajima 7-chome No. 17 No. 17,Trade heavy machinery such as cranes,https://baseconnect.in/companies/keyword/2a970ee1-15a7-45e0-b1eb-37e738712447/companies/a0c4aaa6-b5d1-41f9-87be-bc1482d577a1
有限会社カサイ商事,Trading company industry company,"Headquarters Address: Osaka Prefecture Osaka City, Osaka City, New Imaze 1-chome No.16 No. 14",Company doing food trade,https://baseconnect.in/companies/keyword/2a970ee1-15a7-45e0-b1eb-37e738712447/companies/98a84d41-df05-4e42-bb7a-597d55afdecf
北辰貿易株式会社,Trading company industry company,Headquarters Address: Osaka Prefecture Otsu City Nita-cho 3-chome 6th No. 24,Company doing trade duties,https://baseconnect.in/companies/keyword/2a970ee1-15a7-45e0-b1eb-37e738712447/companies/3d39a111-fafe-49ef-bb90-9a727f51aec5
丸英商事株式会社,Trading company industry company,Headquarters Address: Osaka Prefecture Otsu City Rinkai-cho 1-chome 23,Company doing wholesale and trade of textiles,https://baseconnect.in/companies/keyword/2a970ee1-15a7-45e0-b1eb-37e738712447/companies/9e311f77-5ff5-4212-b05f-a8df7145e0db
加藤貿易株式会社,Trading company industry company,Headquarters Address: Osaka Prefecture Sakai City Nishi Weshashiji Furano-cho West 490,Company that trade precious metals and gems,https://baseconnect.in/companies/keyword/2a970ee1-15a7-45e0-b1eb-37e738712447/companies/6f944df6-fd00-477f-8759-266f9e79d1ec
ＮｉｓｈｉＥｉ　Ｔｒａｄｉｎｇ合同会社,Trading company industry company,Headquarters Address: Osaka Prefecture Sayano City Kasamatsu 1-chome No. 8 13-1,Company that conducts exports such as ingredients and daily necessities and export entrance agency,https://baseconnect.in/companies/keyword/2a970ee1-15a7-45e0-b1eb-37e738712447/companies/59037ba4-5253-4ecc-af05-336063ac2071
中国水産株式会社,Trading company industry company,Headquarters Address: Osaka Prefecture Sayano City Shimizu-cho 5,A company that carries wholesale and food trade of marine products,https://baseconnect.in/companies/keyword/2a970ee1-15a7-45e0-b1eb-37e738712447/companies/7ebb8d4e-e95f-4eb0-a764-2fa1c2edcd5a
金東国際貿易株式会社,Trading company industry company,Headquarters Address: Osaka Prefecture Settsu City Beppu 2-chome 22 No. 2,Company handling chemical products trade transactions,https://baseconnect.in/companies/keyword/2a970ee1-15a7-45e0-b1eb-37e738712447/companies/ea528299-5736-45e1-ad48-0e15e519943f
有限会社新益順商会,Trading company industry company,Headquarters Address: Osaka Prefecture Suita City Momozan Type 3-chome No. No. 11,Companies that trade and wholesale leather products,https://baseconnect.in/companies/keyword/2a970ee1-15a7-45e0-b1eb-37e738712447/companies/ee81ded9-3619-4439-a185-afb5f54dcbce
関西商事株式会社,Trading company industry company,Headquarters Address: Osaka Prefecture Suita City Takaguchi-cho No. 25,Company that carries trade,https://baseconnect.in/companies/keyword/2a970ee1-15a7-45e0-b1eb-37e738712447/companies/0dc8ac2b-657b-4a1f-951d-9a8b5a6127b5
株式会社高松食産,Trading company industry company,Headquarters Address: Osaka Prefecture Takatsuki City Johoku-cho 2-chome No.3 No.3,"Company that conducts food planning, wholesale and trade",https://baseconnect.in/companies/keyword/2a970ee1-15a7-45e0-b1eb-37e738712447/companies/b61d9d67-cb6e-458b-b035-827bb9d1599a
株式会社エフアンドジーエンジニアリング,Trading company industry company,Headquarters Address: Osaka Prefecture Tochigi City Yokemon 1-chome 14th No. 20,Company that perform plastic product processing and wholesale,https://baseconnect.in/companies/keyword/2a970ee1-15a7-45e0-b1eb-37e738712447/companies/764ea62b-339b-48c6-83d3-1c49b8f047ae
有限会社アスカコーポレーション,Trading company industry company,Headquarters Address: Osaka Prefecture Toyonaka City Oshima Town 1-chome No. 8,Company that trade for daily necessities and miscellaneous goods,https://baseconnect.in/companies/keyword/2a970ee1-15a7-45e0-b1eb-37e738712447/companies/06f5dcff-cd4c-4409-8d6b-5265bea5c9c1
宏基実業株式会社,Trading company industry company,Headquarters Address: Osaka Prefecture Wada City Inabachi 932-1,Export and selling waste plastic and non-ferrous metals,https://baseconnect.in/companies/keyword/2a970ee1-15a7-45e0-b1eb-37e738712447/companies/6f903159-6a13-4dfa-957c-ab652ea1a9b2
西田貿易株式会社,Trading company industry company,Headquarters Address: Osaka Prefecture Wada City Kishiricho 21 No. 3,Company that trade fashion textile products,https://baseconnect.in/companies/keyword/2a970ee1-15a7-45e0-b1eb-37e738712447/companies/ec11c0fd-d3e3-4b17-adce-9546de839487
株式会社ＧＢ,Trading company industry company,"Headquarters Address: Osaka Prefecture, Osaka City, Tajima 6-chome No. 6 No. 6",A company that develops wholesale business of various foods for domestic and abroad,https://baseconnect.in/companies/keyword/2a970ee1-15a7-45e0-b1eb-37e738712447/companies/ea17de7b-4a85-4658-92e1-6d83000f5712
株式会社ケーシーコーポレーション,Trading company industry company,"Headquarters Address: Ota-ku, Tokyo 5-chome 41 No. 3 M & M 2-6F",Companys for import and export and trade agency for electronic components,https://baseconnect.in/companies/keyword/2a970ee1-15a7-45e0-b1eb-37e738712447/companies/384d605d-42b6-43a9-8ed8-08c39b8c29ba
多倶貿易有限会社,Trading company industry company,"Headquarters Address: Ota-ku, Tokyo Minami Maguchi 2-chome No. 30 No. 2",A company that handles recycled resource trade,https://baseconnect.in/companies/keyword/2a970ee1-15a7-45e0-b1eb-37e738712447/companies/6c562869-2b88-4447-b746-580a76e49a85
