Company,Industry,Location,Description,URL
株式会社ＳＥＡＬＳ,Trading company industry company,"Headquarters Address: 23 Lands, Yamashita-cho, Yokohama, Kanagawa Prefecture",Company that sells ship transportation and export entrance agency and machine equipment for Asia,https://baseconnect.in/companies/keyword/2a970ee1-15a7-45e0-b1eb-37e738712447/companies/af88848b-0474-4db0-9cc1-0fca4b3880df
株式会社ジービー,Trading company industry company,"Headquarters Address: 25457, Naka, Ibaraki Prefecture","Company that conducts wholesale, sales, import and export of food and cosmetics",https://baseconnect.in/companies/keyword/2a970ee1-15a7-45e0-b1eb-37e738712447/companies/07a5c208-fc8c-417f-942d-4876031841b5
有限会社大カンパニー,Trading company industry company,"Headquarters Address: 3 of Hisashi, Gifu Prefecture, 3",Company that trade for ceramic wholesale and grocery goods,https://baseconnect.in/companies/keyword/2a970ee1-15a7-45e0-b1eb-37e738712447/companies/afdb8561-3444-4510-b0f4-a0b5551411b6
有限会社ケイトレーディング,Trading company industry company,"Headquarters Address: 3 of Kurume City, Kurume City, Fukuoka Prefecture 3",Companies that do import and export and marketing services such as agricultural machinery and industrial machinery,https://baseconnect.in/companies/keyword/2a970ee1-15a7-45e0-b1eb-37e738712447/companies/4e36cee9-ed2b-41e8-8f43-514e051c5615
株式会社東宏トレーディング,Trading company industry company,"Headquarters Address: 3-chome, Shinozaki-cho, Edogawa Ward, Tokyo",Companys that trade China and Japanese parts and products,https://baseconnect.in/companies/keyword/2a970ee1-15a7-45e0-b1eb-37e738712447/companies/c43d0b05-c5a7-497b-aebe-6039f3f18aef
有限会社グリーントレーディング,Trading company industry company,"Headquarters Address: 311st Aoto-cho, Yokohama City, Kanagawa Prefecture 111",Company doing food trade,https://baseconnect.in/companies/keyword/2a970ee1-15a7-45e0-b1eb-37e738712447/companies/cae775e6-874c-41c8-bfa9-30f84eb288c0
株式会社海生,Trading company industry company,"Headquarters Address: 33th of Sanfurah Ward, Sanfula Waville, Saitama Prefecture, Saitama Prefecture",Company that carries wholesale food and drink,https://baseconnect.in/companies/keyword/2a970ee1-15a7-45e0-b1eb-37e738712447/companies/1731f348-bfa0-4a9f-afe1-93032d8a4f7a
株式会社城西,Trading company industry company,"Headquarters Address: 422th of Matsuyama City, Ehime Prefecture 7",A company that mainly handles safety supplies and safety protection supplies used in architecture and civil engineering scene,https://baseconnect.in/companies/keyword/2a970ee1-15a7-45e0-b1eb-37e738712447/companies/b2fe559f-2560-4e46-ba0e-5628657fbd89
株式会社永豊ジャパン,Trading company industry company,"Headquarters Address: 43th of Kanda, Chiyoda-ku, Tokyo","A trading company that exports metals, parts, equipment, etc. to Korea",https://baseconnect.in/companies/keyword/2a970ee1-15a7-45e0-b1eb-37e738712447/companies/118b4582-bce8-4dfd-88e1-93fecc7fee9d
有限会社ビーエーシー,Trading company industry company,"Headquarters Address: 469, Hiju-ku, Hamamatsu City, Shizuoka Prefecture",Company that trade in Shizuoka Prefecture,https://baseconnect.in/companies/keyword/2a970ee1-15a7-45e0-b1eb-37e738712447/companies/5aba3b34-65f7-456c-b4a3-397f66e21cfa
株式会社ケーワールド,Trading company industry company,Headquarters Address: 5 of Gifu Prefecture Toki-Izumacho,Company doing trade,https://baseconnect.in/companies/keyword/2a970ee1-15a7-45e0-b1eb-37e738712447/companies/d6d2396b-d8cb-4acf-a442-e718447177cf
株式会社名南交易,Trading company industry company,"Headquarters Address: 78 Hododa-cho, Mizuho-ku, Aichi Prefecture",Company doing trade,https://baseconnect.in/companies/keyword/2a970ee1-15a7-45e0-b1eb-37e738712447/companies/65df1ce0-8153-44aa-83f9-415690d9b122
有限会社テレコムインド通商,Trading company industry company,"Headquarters Address: 9 of Yasata, Uchiwada, Kanagawa Prefecture",Companies that conduct wholesale such as electrical machinery equipment and roughs,https://baseconnect.in/companies/keyword/2a970ee1-15a7-45e0-b1eb-37e738712447/companies/c56c0adb-d274-404a-8899-12417ae899f4
株式会社ＪＦＳ貿易,Trading company industry company,Headquarters Address: Aichi Inuyama City Keisha Keitan Cave 5th 41,"Companies that are exporting to the equipment for cast iron and cast iron equipment with Korea, the United States and China",https://baseconnect.in/companies/keyword/2a970ee1-15a7-45e0-b1eb-37e738712447/companies/6ed0f4df-6c5b-47cd-9569-7e9a29b976b5
株式会社イーブリッジ,Trading company industry company,"Headquarters Address: Aichi Nagoya City, Aichi Prefecture Kitayama-cho 1-chome 35",Company that trade chemical products,https://baseconnect.in/companies/keyword/2a970ee1-15a7-45e0-b1eb-37e738712447/companies/33d98547-c28b-49b8-a947-0b589e930d3d
株式会社セ・カンド,Trading company industry company,Headquarters Address: Aichi Prefecture Ichinomiya City Omiya 2-chome No. 7 No. 14,Company doing trade,https://baseconnect.in/companies/keyword/2a970ee1-15a7-45e0-b1eb-37e738712447/companies/189ca069-200c-411f-a2cb-852bb40e1cf7
株式会社ウイング,Trading company industry company,Headquarters Address: Aichi Prefecture Ichinomiya City Opening Elights 18,Company doing textile trade,https://baseconnect.in/companies/keyword/2a970ee1-15a7-45e0-b1eb-37e738712447/companies/150c10a5-b840-4f41-9bfa-5d3e194c6eb2
楽商株式会社,Trading company industry company,Headquarters Address: Aichi Prefecture Inazawa City Imamura Munomachi 14th 1,Company carrying metal trade,https://baseconnect.in/companies/keyword/2a970ee1-15a7-45e0-b1eb-37e738712447/companies/a24f17a8-6e8c-4367-970a-92da95d8f77b
ファロージャパン株式会社,Trading company industry company,Headquarters Address: Aichi Prefecture Nagarehouse City Kumada 716,Companies that develop and sell three-dimensional measuring instruments and the associated software,https://baseconnect.in/companies/keyword/2a970ee1-15a7-45e0-b1eb-37e738712447/companies/3c692184-5c87-43fb-922b-3cdbf336ff9a
尾張屋貿易株式会社,Trading company industry company,Headquarters Address: Aichi Prefecture Nagoya City Higashi-Ward Yamagucho-cho No. 7,Company doing trade,https://baseconnect.in/companies/keyword/2a970ee1-15a7-45e0-b1eb-37e738712447/companies/e6bd3bd7-8392-4935-9147-6743f2f226db
親和貿易株式会社,Trading company industry company,Headquarters Address: Aichi Prefecture Nagoya City Higashi-ku Tokugawa 1-chome 607,Company that trade Asian countries and Middle Eastern countries and daily necessities,https://baseconnect.in/companies/keyword/2a970ee1-15a7-45e0-b1eb-37e738712447/companies/88279f5f-1ef6-4fbc-a0b9-06f2abfcd31b
光栄通商株式会社,Trading company industry company,Headquarters Address: Aichi Prefecture Nagoya City Higashi-ku Yoshino 3-chome No.1,Company that trade such as daily necessities goods,https://baseconnect.in/companies/keyword/2a970ee1-15a7-45e0-b1eb-37e738712447/companies/8debaebe-d4ee-43d8-9378-778e79e61a0e
有限会社ケイ・エム・アイ,Trading company industry company,"Headquarters Address: Aichi Prefecture Nagoya City Higashi-ku, Higashi-District 3-chome No. 8",Company doing trade,https://baseconnect.in/companies/keyword/2a970ee1-15a7-45e0-b1eb-37e738712447/companies/aa4da125-10db-49ec-a869-68fbb8cf76ae
有限会社公成,Trading company industry company,Headquarters Address: Aichi Prefecture Nagoya City Kita Ward 1-chome 704,"Companys that import and sell daily necessities, miscellaneous goods, apparel products",https://baseconnect.in/companies/keyword/2a970ee1-15a7-45e0-b1eb-37e738712447/companies/22a40fef-4ea4-44fe-aa99-a47304680a08
星ヶ丘通商株式会社,Trading company industry company,Headquarters Address: Aichi Prefecture Nagoya City Kita Ward 1-chome No. 20 No. 6,Company that conducts overseas sales and repair of industrial equipment such as wire processing machines,https://baseconnect.in/companies/keyword/2a970ee1-15a7-45e0-b1eb-37e738712447/companies/952aa73e-51c0-4c2b-b3a1-269aa3a76e8d
株式会社ジムジョン,Trading company industry company,Headquarters Address: Aichi Prefecture Nagoya City Kita Ward Yatsushiro 2-chome 79,Company doing food trade,https://baseconnect.in/companies/keyword/2a970ee1-15a7-45e0-b1eb-37e738712447/companies/cc8ead5c-ebe9-4faf-852e-8c69bdf0f2df
セントラルシステム機器株式会社,Trading company industry company,Headquarters Address: Aichi Prefecture Nagoya City Mi-ku 3-chome No. 3 No. 3,Company that carries out machine trade and wholesale,https://baseconnect.in/companies/keyword/2a970ee1-15a7-45e0-b1eb-37e738712447/companies/89e511e7-d9f9-44e5-bf5e-41676e569fdb
五英通商株式会社,Trading company industry company,Headquarters Address: Aichi Prefecture Nagoya City Minami Ward Touching 1-chome No.16 No.16,Company that carries wholesale of non-ferrous metal and mineral products,https://baseconnect.in/companies/keyword/2a970ee1-15a7-45e0-b1eb-37e738712447/companies/7e14c554-7183-4d33-afa6-409781696478
名古屋スチールサプライ株式会社,Trading company industry company,Headquarters Address: Aichi Prefecture Nagoya City Minato Ward 3-chome 1313,Company that exports and sell steel products,https://baseconnect.in/companies/keyword/2a970ee1-15a7-45e0-b1eb-37e738712447/companies/a2bcd131-e564-42e0-af00-c14382ccead1
信和株式会社,Trading company industry company,Headquarters Address: Aichi Prefecture Nagoya City Minato Ward Temori 5-chome 2602,Company that works on comprehensive trade business between Japan and China,https://baseconnect.in/companies/keyword/2a970ee1-15a7-45e0-b1eb-37e738712447/companies/aac905fb-af9d-4e7f-a4d5-a52aa3ec9415
株式会社タータン,Trading company industry company,Headquarters Address: Aichi Prefecture Nagoya City Moriyama District Kkimono 1-chome 402,Companies doing care health consulting and labor consulting,https://baseconnect.in/companies/keyword/2a970ee1-15a7-45e0-b1eb-37e738712447/companies/4b20b260-eb83-4e0c-9a4c-2ba620943ae0
株式会社フェニックスコスモ,Trading company industry company,Headquarters Address: Aichi Prefecture Nagoya City Naka-ku 3-chome No. 32 No. 32,A company that trade with Thailand and Hong Kong,https://baseconnect.in/companies/keyword/2a970ee1-15a7-45e0-b1eb-37e738712447/companies/2ef2a926-1877-4189-9be0-edc984e70dac
八神国際貿易株式会社,Trading company industry company,"Headquarters Address: Aichi Prefecture Nagoya City Naka-ku, Naka-ku, Naka-ku, Naka-ku, Naka-Ward No. 29",Company that carries out import and export of physician equipment,https://baseconnect.in/companies/keyword/2a970ee1-15a7-45e0-b1eb-37e738712447/companies/ba463d95-2e2d-4681-8117-dc2512d6206a
日本聖益貿易株式会社,Trading company industry company,"Headquarters Address: Aichi Prefecture Nagoya City Naka-ku, Naka-ku, Naka-ku, Naka-ku, Naka-Ward No.18 No.1",Company that exports textile machine parts and import marine goods,https://baseconnect.in/companies/keyword/2a970ee1-15a7-45e0-b1eb-37e738712447/companies/1a028dbf-089b-4df6-9230-3c4155296ac1
株式会社東海商事,Trading company industry company,Headquarters Address: Aichi Prefecture Nagoya City Nakagawa Ward Kana no Sato 3-chome 1404,Company that trade for daily goods miscellaneous goods,https://baseconnect.in/companies/keyword/2a970ee1-15a7-45e0-b1eb-37e738712447/companies/adc87cc6-b7e5-4187-a3b6-99ec794043fe
株式会社ＬｉｎＫａｇｅ,Trading company industry company,Headquarters Address: Aichi Prefecture Nagoya City Nakamura District Station 4-chome No.17 No.17 No.17 Mejonville 2F,"Companys for purchasing and promotion of imported products, retail and wholesale sales",https://baseconnect.in/companies/keyword/2a970ee1-15a7-45e0-b1eb-37e738712447/companies/be71bd6d-b695-4686-b9ec-60ec74b21d8a
近喜物産株式会社,Trading company industry company,Headquarters Address: Aichi Prefecture Nagoya City Nakamura-kun Nakamura South 2nd-chome No.3 No.1,Company doing food trade,https://baseconnect.in/companies/keyword/2a970ee1-15a7-45e0-b1eb-37e738712447/companies/c7464048-6970-4850-8002-8d4e44d02228
アイテックグローバル株式会社,Trading company industry company,"Headquarters Address: Aichi Prefecture Nagoya City, Thailand, Janko-ku, Thaiju, 186th (New Tome Building 3rd)","A company that is trading as a affiliate of Itec Co., Ltd.",https://baseconnect.in/companies/keyword/2a970ee1-15a7-45e0-b1eb-37e738712447/companies/659ff57d-9c03-44c1-b6e0-15dcf8b32725
天鍾商事株式会社,Trading company industry company,Headquarters Address: Aichi Prefecture Owari Asahi City Otsuka-cho 2-chome 7th 13th Asahi Building 3FS,Company that trade non-ferrous metal and mineral products,https://baseconnect.in/companies/keyword/2a970ee1-15a7-45e0-b1eb-37e738712447/companies/cd2dd25f-fb60-4597-a341-067203fe066f
株式会社フリートレード,Trading company industry company,"Headquarters Address: Aichi Toyohashi City, Toyohashi City, Toyohashi City, Aichi Prefecture 1","A company that carries out non-ferrous metal and mineral products in Toyohashi City, Aichi Prefecture",https://baseconnect.in/companies/keyword/2a970ee1-15a7-45e0-b1eb-37e738712447/companies/09eb6f47-c59d-4698-b806-236bad4704b8
北金産業株式会社,Trading company industry company,Headquarters Address: Aomori Prefecture Aoba 3-chome 4th No. 8,Company doing food trade,https://baseconnect.in/companies/keyword/2a970ee1-15a7-45e0-b1eb-37e738712447/companies/d85a6927-2929-4385-9fca-cdb445710f50
久米商事株式会社,Trading company industry company,"Headquarters Address: Central 5-chome, Nakano-ku, Tokyo 39 Nakano-ku 11th Aoyagi Building Building 6F",Companys that trade Japanese and China such as sheet metal processing equipment and electronic parts,https://baseconnect.in/companies/keyword/2a970ee1-15a7-45e0-b1eb-37e738712447/companies/2dcb3390-670f-4b60-b22c-6b971f8b23db
パミール・ジャパン貿易株式会社,Trading company industry company,Headquarters Address: Chiba Prefecture Inzai City Ryugakuji 464,Company doing trade,https://baseconnect.in/companies/keyword/2a970ee1-15a7-45e0-b1eb-37e738712447/companies/79515c2e-8cb4-4a8c-9425-b54db4f77b07
株式会社中村商会,Trading company industry company,"Headquarters Address: Chigasaki City, Kanagawa Prefecture 927",Companies that trade and purchase used home appliances and machine tools,https://baseconnect.in/companies/keyword/2a970ee1-15a7-45e0-b1eb-37e738712447/companies/c3e3e257-5146-4ec3-9fd6-f00b609db7e8
有限会社相模実業,Trading company industry company,"Headquarters Address: Chigasaki City, Kanagawa Prefecture September 21",Company doing trade,https://baseconnect.in/companies/keyword/2a970ee1-15a7-45e0-b1eb-37e738712447/companies/62033f95-2293-4b82-b93d-19de64fa5bce
マリンコート株式会社,Trading company industry company,"Headquarters Address: Chiyoda Ward, Chiyoda-ku, Tokyo 1-chome No.24 No. 6",Company that imports aquaries such as crabs centered on Russia,https://baseconnect.in/companies/keyword/2a970ee1-15a7-45e0-b1eb-37e738712447/companies/da20e636-ae5b-491a-8d2b-b9744642c1d9
株式会社ＣＭＴ日本,Trading company industry company,"Headquarters Address: Chiyoda Ward, Chiyoda-ku, Tokyo Mitso-cho 1-chome 23 Kanda Omiya Building 5F","Companies that are exporting and selling chemicals, environmental products and health life related products",https://baseconnect.in/companies/keyword/2a970ee1-15a7-45e0-b1eb-37e738712447/companies/7f44c0aa-02b5-40c2-a7a3-2a33aa2948ff
株式会社日商商事,Trading company industry company,"Headquarters Address: Chiyoda-ku, Chiyoda-ku, Tokyo 1-chome 5th No. 6","A company that handles equipment trade in Chiyoda-ku, Tokyo",https://baseconnect.in/companies/keyword/2a970ee1-15a7-45e0-b1eb-37e738712447/companies/0978ad8a-b8d3-4269-a861-c51be15878ec
海外技術交易株式会社,Trading company industry company,"Headquarters Address: Chuo Ward, Tokyo Nihonbashi 2-chome No.16 No. 3",Companies who are selling chemical products trade and allergens,https://baseconnect.in/companies/keyword/2a970ee1-15a7-45e0-b1eb-37e738712447/companies/a62d3d0a-44cb-4f0d-9284-dc8547aa4575
康和商事株式会社,Trading company industry company,"Headquarters Address: Chuo-ku, Osaka City Chuo-ku, Osaka City, Chuo-ku, Chuo-ku, Chuo-ku, Chuo-ku, Osaka No. 7 New Toyama Building 3rd floor",Companies to wholesale and export trade in clothing textile products,https://baseconnect.in/companies/keyword/2a970ee1-15a7-45e0-b1eb-37e738712447/companies/e1b85d4e-be4e-492d-99cf-49fa9fdaaf61
株式会社ニック,Trading company industry company,"Headquarters Address: Chuo-ku, Osaka City Chuo-ku, Osaka Prefecture 3-chome No.11","Company wholesale piping equipment, metal products, machine tools etc",https://baseconnect.in/companies/keyword/2a970ee1-15a7-45e0-b1eb-37e738712447/companies/b19c5725-e8da-4b1a-a9e7-02b768e61c6f
青葉貿易株式会社,Trading company industry company,"Headquarters Address: Chuo-ku, Tokyo 1-chome 4th 1st Cayaba-cho NT Building 4F",Company that carries outgoing and export of ingredients such as food and pharmaceuticals,https://baseconnect.in/companies/keyword/2a970ee1-15a7-45e0-b1eb-37e738712447/companies/fdaa95c7-99c9-40a5-ad7b-a59943bd4a00
有限会社陽光商事,Trading company industry company,"Headquarters Address: Chuo-ku, Tokyo 1-chome No. 8",Companies who are engaged in trade between steel and non-ferrous metals,https://baseconnect.in/companies/keyword/2a970ee1-15a7-45e0-b1eb-37e738712447/companies/a22f5521-0baa-4c0b-87c3-85fbfecf2809
威亞日本株式会社,Trading company industry company,"Headquarters Address: Chuo-ku, Tokyo 2-chome 3rd","Company that cars for import and export of food, medical equipment and electronic components",https://baseconnect.in/companies/keyword/2a970ee1-15a7-45e0-b1eb-37e738712447/companies/e26b1ceb-11ac-43d1-8936-52625a5381f5
金橋インタナショナル株式会社,Trading company industry company,"Headquarters Address: Chuo-ku, Tokyo 6-chome 6th 1st",Companies to export entrance agents and crossing ECs for day-to-day trade,https://baseconnect.in/companies/keyword/2a970ee1-15a7-45e0-b1eb-37e738712447/companies/68a9fc67-8678-4630-9588-85c2fa13033e
株式会社ゴダック,Trading company industry company,"Headquarters Address: Chuo-ku, Tokyo 6-chome No.16 No.1",Company to develop trade business of luxury marine products,https://baseconnect.in/companies/keyword/2a970ee1-15a7-45e0-b1eb-37e738712447/companies/5d519456-883e-4123-a99f-0f3a2ae78967
株式会社オブシディアインターナショナル,Trading company industry company,"Headquarters Address: Chuo-ku, Tokyo Ginza 7-chome 13th No. 6",Company that conducts overseas trade such as miscellaneous goods and daily necessities and cookware,https://baseconnect.in/companies/keyword/2a970ee1-15a7-45e0-b1eb-37e738712447/companies/dc6f13ea-4718-4833-9ade-22167945113e
真崎産業株式会社,Trading company industry company,"Headquarters Address: Chuo-ku, Tokyo Nihonbashi Kayabacho 2-chome No. 7 1",A company that carries out wholesale of physicians and chemical industry materials,https://baseconnect.in/companies/keyword/2a970ee1-15a7-45e0-b1eb-37e738712447/companies/1f50ef45-3329-4f52-a782-449ebc538629
大栄物産株式会社,Trading company industry company,"Headquarters Address: Chuo-ku, Tokyo Nihonbashi Kayabacho 3-chome No.13 No. 6",Company that trade non-ferrous metal and mineral products,https://baseconnect.in/companies/keyword/2a970ee1-15a7-45e0-b1eb-37e738712447/companies/c412632d-c6c6-448a-a0be-a230f97fe688
株式会社マルエイ商事,Trading company industry company,"Headquarters Address: Chuo-ku, Tokyo Nihonbashi Puppet 3-chome 7th 13th Nihonbashi Century Plaza 1201",Company that trade chemical products,https://baseconnect.in/companies/keyword/2a970ee1-15a7-45e0-b1eb-37e738712447/companies/c3b919a1-46c5-4a30-8ef4-7181446a07cb
株式会社シェアスタイル,Trading company industry company,"Headquarters Address: Dazaifu, Fukuoka Prefecture, Taizif City, Hohwa 1-chome 3668","Automotive product sales and installation, hammock sales and trade agency with Vietnam",https://baseconnect.in/companies/keyword/2a970ee1-15a7-45e0-b1eb-37e738712447/companies/5d81a532-8fc1-4b12-a134-9d13cba2cafb
遠東貿易有限会社,Trading company industry company,Headquarters Address: Ehime Prefecture Iyo City Ueno 940,Company working with food trade,https://baseconnect.in/companies/keyword/2a970ee1-15a7-45e0-b1eb-37e738712447/companies/0e06f207-b143-43a2-b7db-67e573d183c1
株式会社ＫＣＹ,Trading company industry company,Headquarters Address: Fukui Prefecture Fukui City 1-chome 11th No. 12,Beauty equipment and cosmetic flux wholesale company,https://baseconnect.in/companies/keyword/2a970ee1-15a7-45e0-b1eb-37e738712447/companies/a6fc17e7-306d-4af7-b41c-2da16f723242
株式会社三和物産,Trading company industry company,Headquarters Address: Fukuoka Prefecture Fukuoka City Hakata Calle 2-chome No. 20 No. 61,Company to trade,https://baseconnect.in/companies/keyword/2a970ee1-15a7-45e0-b1eb-37e738712447/companies/105a00e7-14c8-40f2-ab9e-f2de1102a3e6
株式会社安川商事,Trading company industry company,Headquarters Address: Fukuoka Prefecture Fukuoka City Hakata Ward Chi-5-chome 1-4-S1,Company that trade special goods or clothing goods,https://baseconnect.in/companies/keyword/2a970ee1-15a7-45e0-b1eb-37e738712447/companies/76c7aab2-3dc0-4190-bf7b-8cedf4278ee2
有限会社聖陽貿易,Trading company industry company,Headquarters Address: Fukuoka Prefecture Fukuoka City Hakata Ward Hakata Station South 2nd-chome No. 5 Hakata Sun City Building 6F,Company that imports food produced in a Chinese processing factory,https://baseconnect.in/companies/keyword/2a970ee1-15a7-45e0-b1eb-37e738712447/companies/1db1f619-69b3-4e36-81eb-fce26dec693d
株式会社ワールドブリッヂィ,Trading company industry company,Headquarters Address: Fukuoka Prefecture Fukuoka City Hakata Ward Higashi Naka 3-chome 6-45,"Company that supplies goods and imports, operation of auction, etc.",https://baseconnect.in/companies/keyword/2a970ee1-15a7-45e0-b1eb-37e738712447/companies/6ea552db-4a2d-46b0-8990-16ddddf3d30d
星岡商事株式会社,Trading company industry company,Headquarters Address: Fukuoka Prefecture Fukuoka City Hakata Ward Kami-Tomachi 11-16,Company that conducts wholesale and exportable trade from daily necessities to pharmaceutical products,https://baseconnect.in/companies/keyword/2a970ee1-15a7-45e0-b1eb-37e738712447/companies/1c024a4b-cafb-4695-9b36-f71042c677bb
株式会社偉秋通商,Trading company industry company,Headquarters Address: Fukuoka Prefecture Fukuoka City Hakata Ward Yoshizuka 6-chome 10-1-4F,Company that conducts trade between food and cosmetics,https://baseconnect.in/companies/keyword/2a970ee1-15a7-45e0-b1eb-37e738712447/companies/0bdc6c83-179e-47e4-b4b3-67987c4356f9
ベイトレック株式会社,Trading company industry company,Headquarters Address: Fukuoka Prefecture Fukuoka City Higashi-Ward Kashihahama Fuji 2-chome No. 20,Company doing food trade,https://baseconnect.in/companies/keyword/2a970ee1-15a7-45e0-b1eb-37e738712447/companies/aedcc858-9442-4a95-ab79-3e6cdb5a6ca8
有限会社ナカビシ,Trading company industry company,Headquarters Address: Fukuoka Prefecture Fukuoka City Higashi-Ward Shihiro 3-chome 349,Fisheries and trade companies,https://baseconnect.in/companies/keyword/2a970ee1-15a7-45e0-b1eb-37e738712447/companies/6776b5e1-797b-4da1-94ea-cc9ff9579c79
株式会社佑信協易,Trading company industry company,Headquarters Address: Fukuoka Prefecture Fukuoka City Shirojo Ward Festival 5-chome No. 30,Company doing food trade,https://baseconnect.in/companies/keyword/2a970ee1-15a7-45e0-b1eb-37e738712447/companies/36d0273b-b07d-4b86-8403-c5b5ab1bff70
株式会社九州サポートライン,Trading company industry company,"Headquarters Address: Fukuoka Prefecture Fukuoka City Shirojo-ku Nobu-ku, Nobu-ku, Nobu-ku 11th",A company that trade marine products,https://baseconnect.in/companies/keyword/2a970ee1-15a7-45e0-b1eb-37e738712447/companies/cd672427-ac71-45db-a6a7-34a34a6b1cfc
株式会社サクセサーズグループ,Trading company industry company,"Headquarters Address: Fukuoka Prefecture Hakata Ward, Hakata Ward, Fukuoka City, Fukuoka Prefecture No. 18-213",Company to trade,https://baseconnect.in/companies/keyword/2a970ee1-15a7-45e0-b1eb-37e738712447/companies/c3b87a59-2678-4ed6-884c-daf659b92584
ＬＡＮＴＥＣ国際貿易株式会社,Trading company industry company,"Headquarters Address: Fukuoka Prefecture Higashi-ku, Higashi-ku, Fukuoka Prefecture 14-1-601",Industrial equipment import and export and company import and wholesale of chemicals and rare metals,https://baseconnect.in/companies/keyword/2a970ee1-15a7-45e0-b1eb-37e738712447/companies/8ed35eba-68fe-4b5b-b9cb-81f458302cd4
株式会社タケコーポレーション,Trading company industry company,Headquarters Address: Fukuoka Prefecture Kasuga City Sudau Minami 3-chome 72,Companies that export food such as Japanese cows and wholesale,https://baseconnect.in/companies/keyword/2a970ee1-15a7-45e0-b1eb-37e738712447/companies/67e03c90-ab8a-4d15-b73e-ce2169b74cc6
株式会社木村貿易,Trading company industry company,"Headquarters Address: Funabashi City, Chiba Prefecture 2-chome 4th No. 1",Companies to import and sell domestic trading of construction machinery,https://baseconnect.in/companies/keyword/2a970ee1-15a7-45e0-b1eb-37e738712447/companies/35eb8194-bd8e-4cb5-886e-bfda1b769871
株式会社Ｒ－ｅｖｏｌｕｔｉｏｎ,Trading company industry company,"Headquarters Address: Funabashi City, Chiba Prefecture 5-chome No. 21 21 No. 21","Used goods purchasing, unnecessary product recycling and imported goods, imported car parts for sale",https://baseconnect.in/companies/keyword/2a970ee1-15a7-45e0-b1eb-37e738712447/companies/60b4e70b-2862-4388-bced-58be97a4a14c
