Company,Industry,Location,Description,URL
株式会社オフィスゼロワン,Human resources industry company,Headquarters Address: Minato Ward Shibaura 3-chome 11th No. 7 Root Building 6F,A company that trades jewelry and precious metals,https://baseconnect.in/companies/keyword/2a970ee1-15a7-45e0-b1eb-37e738712447/companies/b960b629-007e-4a9e-a45c-56cd35d1e0fd
東良商事株式会社,Human resources industry company,"Headquarters Address: Minato-ku, Tokyo Minato Ward Shiba Daimon 2-chome 4th No. 5",Company doing trade,https://baseconnect.in/companies/keyword/2a970ee1-15a7-45e0-b1eb-37e738712447/companies/39879cda-2c2b-4075-b84e-996d425ec625
有限会社瀨戸技研,Human resources industry company,"Headquarters Address: Misato City, Saitama Prefecture, Saiseda 5-chome No. 1 Building No. 401",Company doing trade,https://baseconnect.in/companies/keyword/2a970ee1-15a7-45e0-b1eb-37e738712447/companies/d8e61273-7749-4a97-bdb0-c4ba5ca67e87
南星海運ジャパン株式会社,Human resources industry company,"Headquarters Address: Mithmith, Chiyoda-ku, Tokyo 2-chome 9th No.12",Company that manages container regular ship services using the Japan-China route,https://baseconnect.in/companies/keyword/2a970ee1-15a7-45e0-b1eb-37e738712447/companies/9c33121a-77a1-47f5-8138-071d81dd149a
株式会社スペイスワイド,Human resources industry company,"Headquarters Address: Nagoya City, Nagoya City, Nagoya City, Aichi Prefecture 3-chome 6th",Company that conducts trading of Western goods,https://baseconnect.in/companies/keyword/2a970ee1-15a7-45e0-b1eb-37e738712447/companies/1e97e1aa-2e8e-4871-a1eb-d10377184643
株式会社エス・ケー・テック,Human resources industry company,"Headquarters Address: Nagoya, Nagoya, Nagoya City, Aichi Prefecture, Nagoya 3-chome 15th No.11",Companies to export industrial parts and import plastic work products,https://baseconnect.in/companies/keyword/2a970ee1-15a7-45e0-b1eb-37e738712447/companies/bebf06aa-472c-4dd1-a9dc-223dd3366fd6
金雄貿易株式会社,Human resources industry company,Headquarters Address: Naha City Port Town 2-chome No.1,Companies working with metal trade,https://baseconnect.in/companies/keyword/2a970ee1-15a7-45e0-b1eb-37e738712447/companies/e0b148a5-6d6c-4c26-b704-f99676ab89d8
善商交易株式会社,Human resources industry company,"Headquarters Address: Naha City, Okinawa Prefecture Matsuyama 1-chome 30th No. 20",Company doing trade,https://baseconnect.in/companies/keyword/2a970ee1-15a7-45e0-b1eb-37e738712447/companies/29661d5c-425f-4a82-9de7-a61781d454a3
有限会社テラカワコーポレーション,Human resources industry company,"Headquarters Address: Nara Prefecture Nara City, Nara City, Nara City, Nan City, Nara City, Nara City, Nara Prefecture",Company that trade with textile products,https://baseconnect.in/companies/keyword/2a970ee1-15a7-45e0-b1eb-37e738712447/companies/83caeb54-42b3-4d16-963c-591d2b627465
株式会社ペニーワイズプロダクト,Human resources industry company,Headquarters Address: Nishi Azabu 4-chome 10th No. 9,Company doing trade,https://baseconnect.in/companies/keyword/2a970ee1-15a7-45e0-b1eb-37e738712447/companies/1a576177-fc95-4db3-9608-438fb1d17e56
億信貿易有限会社,Human resources industry company,"Headquarters Address: Nishi Seisuka Nishi Midori City, Chiba Prefecture 258",Company doing food trade,https://baseconnect.in/companies/keyword/2a970ee1-15a7-45e0-b1eb-37e738712447/companies/a3bed3bf-dded-43cd-9c6f-780bfbaaf93d
有限会社京葉サーモラックス,Human resources industry company,Headquarters Address: Noda City Noda City Episode City 2,Company that sells car rental and GPS car transmitters,https://baseconnect.in/companies/keyword/2a970ee1-15a7-45e0-b1eb-37e738712447/companies/37f5da42-3f41-436b-b0b0-aefa352a0388
株式会社エルズ・アーチ,Human resources industry company,"Headquarters Address: Ogino, Fukuoka Prefecture Daikai 1-chome No. 23",Company that carries out use,https://baseconnect.in/companies/keyword/2a970ee1-15a7-45e0-b1eb-37e738712447/companies/4d2432b4-eeba-428c-94b1-a13e2b88bf43
株式会社永福,Human resources industry company,"Headquarters Address: Okayama City, Okayama City, Okayama City, Okayama City 155",Company that carries out imports and wholesale such as daily goods,https://baseconnect.in/companies/keyword/2a970ee1-15a7-45e0-b1eb-37e738712447/companies/1c12240d-d16b-4dab-b524-f9517cabca63
有限会社プリティーフーズ,Human resources industry company,Headquarters Address: Okinawa Prefecture Ginowan City Oyama 2-chome No. 13 No. 13,Company handling food trade,https://baseconnect.in/companies/keyword/2a970ee1-15a7-45e0-b1eb-37e738712447/companies/02d4318a-fe11-4014-8b1e-4989aab783dc
有限会社三協貿易,Human resources industry company,Headquarters Address: Okinawa Prefecture Urasu City Daeighing 379,Company doing trade,https://baseconnect.in/companies/keyword/2a970ee1-15a7-45e0-b1eb-37e738712447/companies/45b4b1e7-f3b8-42f0-82d7-b872b0e319e3
大協貿易株式会社,Human resources industry company,Headquarters Address: Osaka Prefecture Chuo Ward Nishidoshinabashi 1-chome No. 28 No. 28,Company that trade chemicals and machinery,https://baseconnect.in/companies/keyword/2a970ee1-15a7-45e0-b1eb-37e738712447/companies/ac8d4eb0-eb45-4b02-b61a-e28b331b7c4e
羽里商事株式会社,Human resources industry company,"Headquarters Address: Osaka Prefecture Chuo Ward, Chuo Ward, Chuo Ward, Chuo-ku, Osaka City, Chuo Ward",The company mainly conducts trading in Japan and Korea,https://baseconnect.in/companies/keyword/2a970ee1-15a7-45e0-b1eb-37e738712447/companies/14decc80-7861-411e-86c5-fc83b64dbc2b
有限会社大阪銀河,Human resources industry company,Headquarters Address: Osaka Prefecture Chuo-ku Namba 2-chome No. 3 No. 11,Company doing trade business,https://baseconnect.in/companies/keyword/2a970ee1-15a7-45e0-b1eb-37e738712447/companies/a84ac27d-61fe-42b7-8920-c15f3b340dbd
株式会社トーヨーアールアンドデー,Human resources industry company,"Headquarters Address: Osaka Prefecture Chuo-ku, Osaka City, Chuo Ward No. 4",Company doing trade,https://baseconnect.in/companies/keyword/2a970ee1-15a7-45e0-b1eb-37e738712447/companies/31239d0c-f4da-4bfd-9276-8066e494ad37
株式会社エヌ・ケイ・ケイ,Human resources industry company,"Headquarters Address: Osaka Prefecture Chuo-ku, Osaka City, Chuo-ku, Chuo-ku 6-1201",Company doing business on trade,https://baseconnect.in/companies/keyword/2a970ee1-15a7-45e0-b1eb-37e738712447/companies/16ad30a2-b528-4aff-8994-fb6cd13c162e
株式会社ＭＵＣＨＮＥＳＳ,Human resources industry company,"Headquarters Address: Osaka Prefecture Chuo-ku, Osaka City, Chuo-ku, Chuo-ku, Chuo-ku, Osaka City Saint-Coville",Company that trade for Western goods,https://baseconnect.in/companies/keyword/2a970ee1-15a7-45e0-b1eb-37e738712447/companies/25fb9d4f-70da-4bab-a47b-1da49674bfa1
有限会社古賀トレーディング,Human resources industry company,"Headquarters Address: Osaka Prefecture Chuo-ku, Osaka City, Chuo-ku, Chuo-ku, Chuo-ku, Osaka City, Chuo-ku, Osaka City",Company that tries from trade and procedures for trade and office work,https://baseconnect.in/companies/keyword/2a970ee1-15a7-45e0-b1eb-37e738712447/companies/d8e4b185-d037-4de3-b684-b7ad2705947e
有限会社ジェイパーツ,Human resources industry company,"Headquarters Address: Osaka Prefecture Chuo-ku, Osaka City, Chuo-ku, Nishidoshinabashi 1-chome No.19 No. 9 Heights Shinsaibashi 601",Company that trade equipment,https://baseconnect.in/companies/keyword/2a970ee1-15a7-45e0-b1eb-37e738712447/companies/7c725a3b-5107-4a56-a497-95389023f176
不二交易株式会社,Human resources industry company,"Headquarters Address: Osaka Prefecture Chuo-ku, Osaka City, Chuo-ku, Osaka City, Chuo-ku, Osaka City",Company handling textile trade,https://baseconnect.in/companies/keyword/2a970ee1-15a7-45e0-b1eb-37e738712447/companies/9363ec93-a802-478b-9765-cb14f30d7a4a
グレース貿易株式会社,Human resources industry company,"Headquarters Address: Osaka Prefecture Chuo-ku, Osaka City, Chuo-ku, Tacho-cho, Chuo-ku, Tachicho, Chuo-ku, Osaka No. 8 Diaplace Building Motomachi",Company doing textile trade,https://baseconnect.in/companies/keyword/2a970ee1-15a7-45e0-b1eb-37e738712447/companies/bd71e323-c6af-4c1c-b7dd-e3b9918b32ea
有限会社シーシーフーズ,Human resources industry company,Headquarters Address: Osaka Prefecture Higashi Osaka City Kawashita 2-chome 63-204,Company handling food trade,https://baseconnect.in/companies/keyword/2a970ee1-15a7-45e0-b1eb-37e738712447/companies/0f51b151-9221-41a1-ba1f-0e73121a72f1
浪速産商株式会社,Human resources industry company,Headquarters Address: Osaka Prefecture Higashi Osaka City Midori-cho 4-chome 11th No. 25,Trading company that works for trade,https://baseconnect.in/companies/keyword/2a970ee1-15a7-45e0-b1eb-37e738712447/companies/ac5d77f4-d398-48eb-98ea-8aaa5d6508f2
株式会社シモカワ,Human resources industry company,Headquarters Address: Osaka Prefecture Higashi Osaka City Takeshi 4-chome No. 4 No. 12,Company doing trade,https://baseconnect.in/companies/keyword/2a970ee1-15a7-45e0-b1eb-37e738712447/companies/0d4f7322-7dc3-48e9-ac87-a4b64d5f2a8b
株式会社メイユー,Human resources industry company,Headquarters Address: Osaka Prefecture Hirakata City Higashida 1-chome No.16 7,Company to trade,https://baseconnect.in/companies/keyword/2a970ee1-15a7-45e0-b1eb-37e738712447/companies/22b3e7e1-50be-4cf7-8192-52b8db7d3c25
豊亞産業株式会社,Human resources industry company,Headquarters Address: Osaka Prefecture Minoh City Minoh 8-chome 6th No. 35,"Companies that do import and export and wholesale such as steel raw materials and steel products, non-ferrous metal products",https://baseconnect.in/companies/keyword/2a970ee1-15a7-45e0-b1eb-37e738712447/companies/15c696a2-076f-4e7c-9166-2f1250bd1cb4
株式会社アール・ケイ,Human resources industry company,Headquarters Address: Osaka Prefecture Nishi Ward Edomori 1-chome 15th No. 20 No. 20 Maru Barefish Bridge Building,Companies to export steel products to East Asia,https://baseconnect.in/companies/keyword/2a970ee1-15a7-45e0-b1eb-37e738712447/companies/e354d006-aeb6-468b-b5b9-4de5221b6950
沼谷商事株式会社,Human resources industry company,"Headquarters Address: Osaka Prefecture Nishi Ward, Nishi-ku, Osaka City, Nishi Ward, Nishi Ward",Company doing trade,https://baseconnect.in/companies/keyword/2a970ee1-15a7-45e0-b1eb-37e738712447/companies/d6a77ab0-87d4-4a1e-8fb7-105750c5a8d6
株式会社ワダトレーディング,Human resources industry company,Headquarters Address: Osaka Prefecture Osaka City Abeno-ku Kitashita 1-chome No.11,Company doing trade,https://baseconnect.in/companies/keyword/2a970ee1-15a7-45e0-b1eb-37e738712447/companies/340b1c75-49ae-4c26-8fbc-a927a451f43a
株式会社テクネツ,Human resources industry company,"Headquarters Address: Osaka Prefecture Osaka City Chuo-ku, Higashiheau 2-chome No. 28-303",Company doing trade,https://baseconnect.in/companies/keyword/2a970ee1-15a7-45e0-b1eb-37e738712447/companies/09677ddb-54bc-491b-ae92-8f36d1f198a6
東和誠泰株式会社,Human resources industry company,Headquarters Address: Osaka Prefecture Osaka City Corporation New Imestival 4-chome No. No. 3,Company handling trade,https://baseconnect.in/companies/keyword/2a970ee1-15a7-45e0-b1eb-37e738712447/companies/f4eaaf85-d709-47a8-995c-93293bf33ceb
ダックス株式会社,Human resources industry company,Headquarters Address: Osaka Prefecture Osaka City Fukushima Ward Fukushima 2-chome 10th 19-1201,Company that trade equipment,https://baseconnect.in/companies/keyword/2a970ee1-15a7-45e0-b1eb-37e738712447/companies/8b46c127-fd7e-4870-b282-cc8b5e0a887a
品澤株式会社,Human resources industry company,Headquarters Address: Osaka Prefecture Osaka City Kita Ward Ikeda-cho 1-2-1246,Company doing general trade,https://baseconnect.in/companies/keyword/2a970ee1-15a7-45e0-b1eb-37e738712447/companies/4a1493e5-2035-4c86-95cb-55efd7d3e8f8
有限会社互栄貿易商会,Human resources industry company,Headquarters Address: Osaka Prefecture Osaka City Kita Ward Son South 2-chome No. 8,Company that trade materials and industrial machinery equipment,https://baseconnect.in/companies/keyword/2a970ee1-15a7-45e0-b1eb-37e738712447/companies/60e4a664-8177-4e0e-a813-5ceef1dd370d
日本化学貿易株式会社,Human resources industry company,Headquarters Address: Osaka Prefecture Osaka City Kita Ward Umeda 1-chome 2-1400 Osaka Ekimae Second Building,Company that conducts trading such as special chemical products,https://baseconnect.in/companies/keyword/2a970ee1-15a7-45e0-b1eb-37e738712447/companies/d0091155-abdc-492c-9a97-0eb4fff55ab0
株式会社カンサイスティール,Human resources industry company,Headquarters Address: Osaka Prefecture Osaka City Kita-Ward 3-chome 3rd No. 3,Company that trade with Latin American countries,https://baseconnect.in/companies/keyword/2a970ee1-15a7-45e0-b1eb-37e738712447/companies/efbdac0e-a63e-4ca6-be52-12aa010ad729
居仁産業株式会社,Human resources industry company,Headquarters Address: Osaka Prefecture Osaka City Nanami Ward 1-chome No. 3 No. 20,Company doing trade,https://baseconnect.in/companies/keyword/2a970ee1-15a7-45e0-b1eb-37e738712447/companies/9cd4db7d-214a-4fe4-8366-1a5e03c04852
大友商事株式会社,Human resources industry company,Headquarters Address: Osaka Prefecture Osaka City Nanami Ward Sakuragawa 4-chome 14th No. 1A 1A,Company carrying various devices and food trade,https://baseconnect.in/companies/keyword/2a970ee1-15a7-45e0-b1eb-37e738712447/companies/40ece895-bff0-4d20-bef0-38178205f09b
クボタマシナリートレーディング株式会社,Human resources industry company,Headquarters Address: Osaka Prefecture Osaka City Nanimi-Ward Situi 1-chome 2nd 47,Companies to export and export production parts and trade between three countries,https://baseconnect.in/companies/keyword/2a970ee1-15a7-45e0-b1eb-37e738712447/companies/e38dd52b-76c9-4b72-b415-ee4d2c3623ab
ワールド通商株式会社,Human resources industry company,Headquarters Address: Osaka Prefecture Osaka City Nishinjo Ward 17th J-chome 838,Company doing trade,https://baseconnect.in/companies/keyword/2a970ee1-15a7-45e0-b1eb-37e738712447/companies/4248d8aa-9799-4106-8525-ece866320720
株式会社生光商会,Human resources industry company,Headquarters Address: Osaka Prefecture Osaka City Nishiyuki-Ward Nishiyuki 1-chome 2nd 56-915,Company carrying metal wholesale,https://baseconnect.in/companies/keyword/2a970ee1-15a7-45e0-b1eb-37e738712447/companies/8163590e-8d2f-4275-8219-953eceb40b6b
ハスコ・インターナショナル株式会社,Human resources industry company,Headquarters Address: Osaka Prefecture Osaka City Tennoji Ward Shiba 2-chome No. 5 No. 4,Company to export sporting goods,https://baseconnect.in/companies/keyword/2a970ee1-15a7-45e0-b1eb-37e738712447/companies/7a8b0637-59e8-4324-85fd-b1051e43265b
岡本弘商事株式会社,Human resources industry company,Headquarters Address: Osaka Prefecture Osaka City Yodogawa Ward Nishinakajima 3-chome No. 12 12 Shin Osaka Nanami Building,"Company that trade in Yodogawa Ward, Osaka City",https://baseconnect.in/companies/keyword/2a970ee1-15a7-45e0-b1eb-37e738712447/companies/f276eeb0-25e6-4dc2-adae-106d7427fea9
万方経済交流株式会社,Human resources industry company,Headquarters Address: Osaka Prefecture Osaka City Yodogawa Ward Nishinakajima 3-chome No. 7 8,A company handling personnel consulting,https://baseconnect.in/companies/keyword/2a970ee1-15a7-45e0-b1eb-37e738712447/companies/5da64a42-65fc-46ac-97d2-e7c55cde8c0c
株式会社小倉貿易,Human resources industry company,Headquarters Address: Osaka Prefecture Osaka City Yodogawa Ward Nishinakajima 6-chome No. 3 No. 3,Company that conducts agency for import and export and consulting in China,https://baseconnect.in/companies/keyword/2a970ee1-15a7-45e0-b1eb-37e738712447/companies/b9944f61-29b4-4294-8160-c765d49726d1
株式会社オリテックス,Human resources industry company,"Headquarters Address: Ota-ku, Tokyo, Ota-ku, Tokyo 14th No. 18",Company doing fiber trade,https://baseconnect.in/companies/keyword/2a970ee1-15a7-45e0-b1eb-37e738712447/companies/00aaaf1a-09a1-4d83-a988-f20ad57a7cb0
有限会社アイランド商事,Human resources industry company,"Headquarters Address: Ota-ku, Tokyo, Ota-ku, Tokyo 2-chome 28th No. 7",Company doing food trade,https://baseconnect.in/companies/keyword/2a970ee1-15a7-45e0-b1eb-37e738712447/companies/1e94d508-41bc-43b6-aeb3-6396ed027e05
有限会社エドム企画,Human resources industry company,"Headquarters Address: Otsuki Miyuki, Yamanashi Prefecture Okito Maiko 1",Company handling equipment trade,https://baseconnect.in/companies/keyword/2a970ee1-15a7-45e0-b1eb-37e738712447/companies/05b4441d-13ab-4b49-b624-46d60e7276be
有限会社大全,Human resources industry company,"Headquarters Address: Sagata City, Chiba Prefecture Santa 895",Company doing trade,https://baseconnect.in/companies/keyword/2a970ee1-15a7-45e0-b1eb-37e738712447/companies/75f760b8-6155-4488-ba0d-fe9316a90a64
国際実務通商株式会社,Human resources industry company,Headquarters Address: Saitama Prefecture Saitama City Kita Ward Miyahara-cho 4-chome 88,"A company that provides establishment of a factory, trade support and human resource introduction",https://baseconnect.in/companies/keyword/2a970ee1-15a7-45e0-b1eb-37e738712447/companies/c29e11f3-054f-46e1-8c12-27d99fe69fc0
三富株式会社,Human resources industry company,Headquarters Address: Saitama Prefecture Saitama City Urawa Region 3-chome 13th 3rd,Company that supports business development to China,https://baseconnect.in/companies/keyword/2a970ee1-15a7-45e0-b1eb-37e738712447/companies/6cf8ca94-17b0-472b-93b2-213b1c1fecf7
有限会社東北エンヂン興業,Human resources industry company,"Headquarters Address: Senboku City, Akita Prefecture",Company that is trading,https://baseconnect.in/companies/keyword/2a970ee1-15a7-45e0-b1eb-37e738712447/companies/45975f75-858e-4f9d-b5c1-5cde60a4b95f
株式会社Ｄｒｅａｍ’ｓ　Ｃｏｍｍｅｒｃｅ,Human resources industry company,"Headquarters Address: Shibuya 3-chome, Shibuya, Shibuya-ku, Tokyo Shibuya 3-chome Square Building 2nd floor",Company that perform sales agency and sales overseas,https://baseconnect.in/companies/keyword/2a970ee1-15a7-45e0-b1eb-37e738712447/companies/9c4b51d3-9d32-4055-aa08-7b0c9d4d8856
有限会社コスモインターナショナル,Human resources industry company,"Headquarters Address: Shibuya-ku, Tokyo 2-chome 12th issue","A company that carries trade agency, English, Spanish translation, interpretation, etc.",https://baseconnect.in/companies/keyword/2a970ee1-15a7-45e0-b1eb-37e738712447/companies/23a8da97-c0f3-4006-9c11-2d98945058b7
ロイヤルエンタープライズ株式会社,Human resources industry company,"Headquarters Address: Shinbashi, Minato-ku, Tokyo 5-chome No. 8 1 Hikagukuraku Building",Company to trade,https://baseconnect.in/companies/keyword/2a970ee1-15a7-45e0-b1eb-37e738712447/companies/b0f2deb4-0b70-4a78-b0a3-3d0d0daa4868
ブイ・アイ・ピーオーバーシーズ有限会社,Human resources industry company,Headquarters Address: Shinjuku Shinjuku 1-chome No. 31 No. 7,Company doing trade,https://baseconnect.in/companies/keyword/2a970ee1-15a7-45e0-b1eb-37e738712447/companies/0bc4bf9b-70b8-4d32-8bd0-6151f5f57ae7
株式会社アルファホールディング,Human resources industry company,"Headquarters Address: Shokicho, Shinjuku-ku, Tokyo 2 Fan Kagurazaka 401",Companies to intervening import mediation of building materials,https://baseconnect.in/companies/keyword/2a970ee1-15a7-45e0-b1eb-37e738712447/companies/1af9b99a-6fe5-4ebf-83cd-f2b4362bebbe
台祥貿易有限会社,Human resources industry company,"Headquarters Address: Suginami-ku, Tokyo Nazugawa, Nazugawa-ku, Nazugawa-ku, Tokyo No.22 No.17","A company that carries trade mediation and export / export lines between Japanese, Taiwan and China companies",https://baseconnect.in/companies/keyword/2a970ee1-15a7-45e0-b1eb-37e738712447/companies/04a23d2e-43b1-4ed4-b807-9aaf56df3bb0
弘業株式会社,Human resources industry company,"Headquarters Address: Sumida-ku, Tokyo 4-chome 1-101",Company doing trade,https://baseconnect.in/companies/keyword/2a970ee1-15a7-45e0-b1eb-37e738712447/companies/74bdfcf9-7e1d-47f8-874a-4736ac3b5c51
株式会社国際環境システムズ,Human resources industry company,Headquarters Address: Tokyo Adachi District Fan 1-chome No. 8,Company doing trade,https://baseconnect.in/companies/keyword/2a970ee1-15a7-45e0-b1eb-37e738712447/companies/c34dc2e1-9430-4f77-b41e-d6007daff539
タイガー株式会社,Human resources industry company,Headquarters Address: Tokyo Bunkyo Ward Sendo 3-chome 24 No. 5 Maison Hiro II 202 Room,Company to trade,https://baseconnect.in/companies/keyword/2a970ee1-15a7-45e0-b1eb-37e738712447/companies/385fa47d-a584-4b5d-a972-e7d2c4212ced
イーリン有限会社,Human resources industry company,Headquarters Address: Tokyo City Adachi-ku Senju 1-chome 4th 1-1808,Company doing trade,https://baseconnect.in/companies/keyword/2a970ee1-15a7-45e0-b1eb-37e738712447/companies/95477799-5893-4bf6-9805-07058f8d834a
有限会社サンスン,Human resources industry company,Headquarters Address: Tokyo City Aoi-ku Nishin-cho 3-chome No.18 No. 5,Company to trade,https://baseconnect.in/companies/keyword/2a970ee1-15a7-45e0-b1eb-37e738712447/companies/1e3e3730-8738-47cb-bb21-1cd190cf8997
有限会社マイテキスタイル,Human resources industry company,Headquarters Address: Tokyo City Setagaya Ward Sengjo 5-chome 11th No. 5,Company doing fiber trade,https://baseconnect.in/companies/keyword/2a970ee1-15a7-45e0-b1eb-37e738712447/companies/3cfa3671-5d67-4f7f-8b0a-cf961143418e
サンスイ・トレーディング株式会社,Human resources industry company,Headquarters Address: Tokyo Metropolitan Demple City Municho 1-chome No. 5 12th Twin Leaf Kokubunji,Company doing import and export trade,https://baseconnect.in/companies/keyword/2a970ee1-15a7-45e0-b1eb-37e738712447/companies/98c92432-e693-427d-9dde-bc0d708f2c07
パーセプトロンアジアパシフィック株式会社,Human resources industry company,Headquarters Address: Tokyo Toshima Ward Ikebukuro 2-chome 54 No. 12 Joined Ikebukuro Daiichi Building 4F,A company that works for trade and wholesale such as optical measurement equipment and laser scanner,https://baseconnect.in/companies/keyword/2a970ee1-15a7-45e0-b1eb-37e738712447/companies/38cc128c-f8ee-402a-b93b-a7108422920c
千宝国際貿易株式会社,Human resources industry company,"Headquarters Address: Toshima Ward, Toshima Ward, Toshima Ward, Toshima Ward, Toshima Ward, Toshima, Toshima Ward",Company doing trade,https://baseconnect.in/companies/keyword/2a970ee1-15a7-45e0-b1eb-37e738712447/companies/d49ea4e8-8e5a-4e9e-8373-f22d991e1ff1
リングストン株式会社,Human resources industry company,"Headquarters Address: Toshima-ku, Tokyo Ikebukuro 2-chome 75 1 1st Kishin Building 1F",Company doing overseas trade,https://baseconnect.in/companies/keyword/2a970ee1-15a7-45e0-b1eb-37e738712447/companies/dce13314-55d3-4ca4-af71-2d87ac961edc
振遠株式会社,Human resources industry company,"Headquarters Address: Toshima-ku, Toshima-ku, Tokyo 1-chome No. 5 Murata Building 301","Company that conducts telecommunications business, provider business and recycling",https://baseconnect.in/companies/keyword/2a970ee1-15a7-45e0-b1eb-37e738712447/companies/51d2f005-318b-4a34-a7cf-c3fb88a606e3
Ｊ－ＣＲＯＯＺ株式会社,Human resources industry company,"Headquarters Address: Toyokawa City, Aichi Prefecture Namiyama Nitta Nitta 9",Company that conducts trade and IT consulting such as steel materials,https://baseconnect.in/companies/keyword/2a970ee1-15a7-45e0-b1eb-37e738712447/companies/0349719c-9b44-4805-83a7-7f505523fdb7
株式会社さき商会,Human resources industry company,Headquarters Address: Urasoe City Okinawa Prefecture Sao Thai 1-chome 31 No. 2,Company doing trade,https://baseconnect.in/companies/keyword/2a970ee1-15a7-45e0-b1eb-37e738712447/companies/8aff6ffc-d1c5-4305-a339-109908a97ad1
新国際商運株式会社,Human resources industry company,"Headquarters Address: Yamashita-cho, Yokohama, Yokohama, Kanagawa Prefecture",Company doing trade,https://baseconnect.in/companies/keyword/2a970ee1-15a7-45e0-b1eb-37e738712447/companies/b647360d-9057-4dc3-8289-7e07f7b27e8b
株式会社ひかり商事,Human resources industry company,"Headquarters Address: Yokohama City, Yokohama City, Kanagawa Prefecture, Yokohama-cho, Chome, Nakano-cho, Naka-ku, Yokohama, Yokohama City, Yokohama City, Yokohama, Yokohama, Yokohama, Yokohama, Yokohama Prefecture.",Company doing trade,https://baseconnect.in/companies/keyword/2a970ee1-15a7-45e0-b1eb-37e738712447/companies/a1ec5a6a-4b86-4a91-a7b6-2a95dbe2be2a
株式会社ワイ・ティー・シー,Human resources industry company,"Headquarters Address: Yokohama City, Yokohama City, Yokohama City, Yokohama City",Company doing trade,https://baseconnect.in/companies/keyword/2a970ee1-15a7-45e0-b1eb-37e738712447/companies/4496e17f-0bb6-4d11-a67e-fe9aae0d07d6
有限会社イチバン貿易,Human resources industry company,"Headquarters Address: Yokohama City, Yokohama, Kanagawa Prefecture Makento 23-11",Company doing trade,https://baseconnect.in/companies/keyword/2a970ee1-15a7-45e0-b1eb-37e738712447/companies/b7cc8e43-b1b5-4443-8c05-c13bea8e1b55
株式会社ティーアンドアール,Human resources industry company,"Headquarters Address: Yoyogaya, Shibuya-ku, Tokyo 2-chome 21-305",A company that handles trading of trade such as chemical industry products,https://baseconnect.in/companies/keyword/2a970ee1-15a7-45e0-b1eb-37e738712447/companies/e5b51293-0551-4419-8b20-70bdcf7ccd36
